[
  {
    "stage_id": "S0_DOCUMENTATION_LOCK",
    "goal": "Create and validate the complete canonical documentation package.",
    "owner": "Taras",
    "start_date": "2026-06-16",
    "deadline": "2026-06-17",
    "maximum_timebox_days": 2,
    "planned_budget": 0,
    "maximum_budget": 0,
    "entry_criteria": ["Repository exists", "Current product direction known"],
    "in_scope": ["Product canon", "Commercial canon", "Roadmap", "Budgets", "Requirements", "Testing", "Governance", "Validation proof"],
    "out_of_scope": ["New gameplay features", "Paid launch", "Backend implementation"],
    "deliverables": ["docs/README.md", "docs/data/proof.json", "docs/data/artifact-index.json"],
    "required_tests": ["documentation_validation"],
    "required_evidence": ["validation script output", "artifact index"],
    "kpi_thresholds": { "empty_documents": 0, "forbidden_tokens": 0, "stage_contracts_valid": 6 },
    "zero_tolerance": { "todo_tbd_placeholder": true, "missing_go_hold_pivot_stop": true },
    "go_conditions": ["proof.json reports COMPLETE_AND_LOCKED"],
    "hold_conditions": ["validation script fails"],
    "pivot_conditions": ["documentation scope conflicts with product owner direction"],
    "stop_conditions": ["owner rejects managed-product framing"],
    "next_allowed_stage": "S1_PROTOTYPE_REPAIR"
  },
  {
    "stage_id": "S1_PROTOTYPE_REPAIR",
    "goal": "Turn the first episode into a clear, playable, realistic demo.",
    "owner": "Engineering collaborator",
    "start_date": "2026-06-18",
    "deadline": "2026-06-30",
    "maximum_timebox_days": 13,
    "planned_budget": 250,
    "maximum_budget": 450,
    "entry_criteria": ["S0 GO", "Real apartment scene image available"],
    "in_scope": ["Multi-zone apartment design", "Containers such as fridge and cabinets", "Item explanations", "Result debrief", "Mobile visual review"],
    "out_of_scope": ["3D", "Accounts", "Payments", "More than one polished episode"],
    "deliverables": ["polished first episode", "visual review screenshots", "usability notes"],
    "required_tests": ["build", "desktop visual", "mobile visual", "manual usability"],
    "required_evidence": ["5 user observations or owner review if users unavailable"],
    "kpi_thresholds": { "first_time_completion_rate": 0.6, "critical_confusion_count": 1 },
    "zero_tolerance": { "invisible_required_item": true, "unsafe_claim": true },
    "go_conditions": ["first-time user can understand goal", "scene has no impossible hidden item"],
    "hold_conditions": ["users cannot distinguish search versus selection"],
    "pivot_conditions": ["hidden-object format proves unclear after two revisions"],
    "stop_conditions": ["visual asset cannot support gameplay"],
    "next_allowed_stage": "S2_FREE_DEMO_VALIDATION"
  },
  {
    "stage_id": "S2_FREE_DEMO_VALIDATION",
    "goal": "Validate message, demo completion, and early commercial intent.",
    "owner": "Taras",
    "start_date": "2026-07-01",
    "deadline": "2026-07-14",
    "maximum_timebox_days": 14,
    "planned_budget": 350,
    "maximum_budget": 600,
    "entry_criteria": ["S1 GO", "landing copy ready", "analytics plan ready"],
    "in_scope": ["Landing page", "problem interviews", "message tests", "waitlist", "demo analytics"],
    "out_of_scope": ["Paid ads at scale", "full course build"],
    "deliverables": ["landing page", "interview report", "validation report"],
    "required_tests": ["landing QA", "demo E2E", "analytics QA"],
    "required_evidence": ["300 qualified visits or 15 interviews", "completion data"],
    "kpi_thresholds": { "landing_to_demo_start": 0.2, "demo_start_to_completion": 0.45, "completion_to_paid_intent": 0.08 },
    "zero_tolerance": { "misleading_marketing_claim": true },
    "go_conditions": ["paid intent or strong interview evidence meets threshold"],
    "hold_conditions": ["traffic insufficient but qualitative evidence strong"],
    "pivot_conditions": ["message unclear but problem strong"],
    "stop_conditions": ["no problem evidence and no paid intent"],
    "next_allowed_stage": "S3_MVP_COURSE_BUILD"
  },
  {
    "stage_id": "S3_MVP_COURSE_BUILD",
    "goal": "Build the six-episode MVP mini-course.",
    "owner": "Engineering collaborator",
    "start_date": "2026-07-15",
    "deadline": "2026-08-11",
    "maximum_timebox_days": 28,
    "planned_budget": 900,
    "maximum_budget": 1200,
    "entry_criteria": ["S2 GO", "MVP scope unchanged or change request approved"],
    "in_scope": ["Six episodes", "RU/EN localization", "content review workflow", "progress summary"],
    "out_of_scope": ["Native app", "multiplayer", "runtime AI"],
    "deliverables": ["six playable episodes", "review records", "MVP build"],
    "required_tests": ["build", "episode E2E", "visual matrix", "content review"],
    "required_evidence": ["all episodes pass Product Definition of Done"],
    "kpi_thresholds": { "episode_completion_without_help": 0.5, "reviewed_safety_claims": 1.0 },
    "zero_tolerance": { "unreviewed_medical_claim": true },
    "go_conditions": ["six episodes accepted"],
    "hold_conditions": ["one or two episodes need revision"],
    "pivot_conditions": ["course too large for engagement"],
    "stop_conditions": ["unsafe content cannot be corrected"],
    "next_allowed_stage": "S4_CLOSED_BETA"
  },
  {
    "stage_id": "S4_CLOSED_BETA",
    "goal": "Test the MVP course with a closed learner cohort.",
    "owner": "Taras",
    "start_date": "2026-08-12",
    "deadline": "2026-08-25",
    "maximum_timebox_days": 14,
    "planned_budget": 500,
    "maximum_budget": 750,
    "entry_criteria": ["S3 GO", "support channel ready"],
    "in_scope": ["20-user beta", "learning checks", "bug triage", "pricing interview"],
    "out_of_scope": ["public paid launch", "large paid ads"],
    "deliverables": ["beta report", "issue list", "pricing evidence"],
    "required_tests": ["beta completion analysis", "support response test", "payment dry run"],
    "required_evidence": ["20 invited users", "5 feedback interviews"],
    "kpi_thresholds": { "three_episode_completion": 0.4, "would_pay_signal": 0.25 },
    "zero_tolerance": { "severe_unsafe_content": true },
    "go_conditions": ["learning and willingness-to-pay evidence pass"],
    "hold_conditions": ["bugs fixable within one week"],
    "pivot_conditions": ["users like game but not paid promise"],
    "stop_conditions": ["users do not complete or learn"],
    "next_allowed_stage": "S5_PAID_PILOT"
  },
  {
    "stage_id": "S5_PAID_PILOT",
    "goal": "Obtain first real paying users and validate delivery.",
    "owner": "Taras",
    "start_date": "2026-08-26",
    "deadline": "2026-09-14",
    "maximum_timebox_days": 20,
    "planned_budget": 1000,
    "maximum_budget": 1500,
    "entry_criteria": ["S4 GO", "payment path ready", "support path ready", "legal/safety review complete"],
    "in_scope": ["10 individual buyers or 2 instructor buyers", "manual support", "pilot report"],
    "out_of_scope": ["scaling ads", "subscription", "production_accepted=true"],
    "deliverables": ["paid pilot checkout", "buyer list", "pilot report", "GO/HOLD/PIVOT/STOP decision"],
    "required_tests": ["payment test", "access test", "support test", "production gate review"],
    "required_evidence": ["real payment", "buyer feedback", "support issue log"],
    "kpi_thresholds": { "individual_buyers": 10, "instructor_buyers": 2, "refund_rate_max": 0.15 },
    "zero_tolerance": { "broken_paid_access": true, "unreviewed_paid_claim": true },
    "go_conditions": ["real payment target met", "delivery promise met"],
    "hold_conditions": ["buyers interested but payment path friction high"],
    "pivot_conditions": ["instructors pay but individuals do not, or reverse"],
    "stop_conditions": ["no buyers after validated traffic and direct outreach"],
    "next_allowed_stage": "POST_PILOT_SCALE_DECISION"
  }
]
